{
  "schema_version": "1.0.0",
  "obd": {
    "supported_pids": [
      "0x05",
      "0x0C",
      "0x0D"
    ],
    "samples": [
      {
        "mode": 1,
        "pid": "0xd",
        "name": "vehicle_speed",
        "t_utc": 1752624000.7,
        "raw": "",
        "value": 0,
        "unit": "km/h"
      },
      {
        "mode": 1,
        "pid": "0xc",
        "name": "engine_rpm",
        "t_utc": 1752624000.7,
        "raw": "",
        "value": 981,
        "unit": "rpm"
      },
      {
        "mode": 1,
        "pid": "0x5",
        "name": "coolant_temp",
        "t_utc": 1752624000.7,
        "raw": "",
        "value": 40,
        "unit": "degC"
      },
      {
        "mode": 1,
        "pid": "0xd",
        "name": "vehicle_speed",
        "t_utc": 1752624001.2,
        "raw": "",
        "value": 3,
        "unit": "km/h"
      },
      {
        "mode": 1,
        "pid": "0xc",
        "name": "engine_rpm",
        "t_utc": 1752624001.2,
        "raw": "",
        "value": 1581,
        "unit": "rpm"
      },
      {
        "mode": 1,
        "pid": "0x5",
        "name": "coolant_temp",
        "t_utc": 1752624001.2,
        "raw": "",
        "value": 40,
        "unit": "degC"
      },
      {
        "mode": 1,
        "pid": "0xd",
        "name": "vehicle_speed",
        "t_utc": 1752624001.7,
        "raw": "",
        "value": 5,
        "unit": "km/h"
      },
      {
        "mode": 1,
        "pid": "0xc",
        "name": "engine_rpm",
        "t_utc": 1752624001.7,
        "raw": "",
        "value": 2041,
        "unit": "rpm"
      },
      {
        "mode": 1,
        "pid": "0x5",
        "name": "coolant_temp",
        "t_utc": 1752624001.7,
        "raw": "",
        "value": 40,
        "unit": "degC"
      },
      {
        "mode": 1,
        "pid": "0xd",
        "name": "vehicle_speed",
        "t_utc": 1752624002.2,
        "raw": "",
        "value": 8,
        "unit": "km/h"
      },
      {
        "mode": 1,
        "pid": "0xc",
        "name": "engine_rpm",
        "t_utc": 1752624002.2,
        "raw": "",
        "value": 2578,
        "unit": "rpm"
      },
      {
        "mode": 1,
        "pid": "0x5",
        "name": "coolant_temp",
        "t_utc": 1752624002.2,
        "raw": "",
        "value": 40,
        "unit": "degC"
      },
      {
        "mode": 1,
        "pid": "0xd",
        "name": "vehicle_speed",
        "t_utc": 1752624002.7,
        "raw": "",
        "value": 10,
        "unit": "km/h"
      },
      {
        "mode": 1,
        "pid": "0xc",
        "name": "engine_rpm",
        "t_utc": 1752624002.7,
        "raw": "",
        "value": 3085,
        "unit": "rpm"
      },
      {
        "mode": 1,
        "pid": "0x5",
        "name": "coolant_temp",
        "t_utc": 1752624002.7,
        "raw": "",
        "value": 40,
        "unit": "degC"
      },
      {
        "mode": 1,
        "pid": "0xd",
        "name": "vehicle_speed",
        "t_utc": 1752624003.2,
        "raw": "",
        "value": 12,
        "unit": "km/h"
      },
      {
        "mode": 1,
        "pid": "0xc",
        "name": "engine_rpm",
        "t_utc": 1752624003.2,
        "raw": "",
        "value": 1030,
        "unit": "rpm"
      },
      {
        "mode": 1,
        "pid": "0x5",
        "name": "coolant_temp",
        "t_utc": 1752624003.2,
        "raw": "",
        "value": 40,
        "unit": "degC"
      },
      {
        "mode": 1,
        "pid": "0xd",
        "name": "vehicle_speed",
        "t_utc": 1752624003.7,
        "raw": "",
        "value": 14,
        "unit": "km/h"
      },
      {
        "mode": 1,
        "pid": "0xc",
        "name": "engine_rpm",
        "t_utc": 1752624003.7,
        "raw": "",
        "value": 1447,
        "unit": "rpm"
      },
      {
        "mode": 1,
        "pid": "0x5",
        "name": "coolant_temp",
        "t_utc": 1752624003.7,
        "raw": "",
        "value": 40,
        "unit": "degC"
      },
      {
        "mode": 1,
        "pid": "0xd",
        "name": "vehicle_speed",
        "t_utc": 1752624004.2,
        "raw": "",
        "value": 16,
        "unit": "km/h"
      },
      {
        "mode": 1,
        "pid": "0xc",
        "name": "engine_rpm",
        "t_utc": 1752624004.2,
        "raw": "",
        "value": 1873,
        "unit": "rpm"
      },
      {
        "mode": 1,
        "pid": "0x5",
        "name": "coolant_temp",
        "t_utc": 1752624004.2,
        "raw": "",
        "value": 40,
        "unit": "degC"
      },
      {
        "mode": 1,
        "pid": "0xd",
        "name": "vehicle_speed",
        "t_utc": 1752624004.7,
        "raw": "",
        "value": 18,
        "unit": "km/h"
      },
      {
        "mode": 1,
        "pid": "0xc",
        "name": "engine_rpm",
        "t_utc": 1752624004.7,
        "raw": "",
        "value": 2278,
        "unit": "rpm"
      },
      {
        "mode": 1,
        "pid": "0x5",
        "name": "coolant_temp",
        "t_utc": 1752624004.7,
        "raw": "",
        "value": 40,
        "unit": "degC"
      },
      {
        "mode": 1,
        "pid": "0xd",
        "name": "vehicle_speed",
        "t_utc": 1752624005.2,
        "raw": "",
        "value": 20,
        "unit": "km/h"
      },
      {
        "mode": 1,
        "pid": "0xc",
        "name": "engine_rpm",
        "t_utc": 1752624005.2,
        "raw": "",
        "value": 2651,
        "unit": "rpm"
      },
      {
        "mode": 1,
        "pid": "0x5",
        "name": "coolant_temp",
        "t_utc": 1752624005.2,
        "raw": "",
        "value": 40,
        "unit": "degC"
      },
      {
        "mode": 1,
        "pid": "0xd",
        "name": "vehicle_speed",
        "t_utc": 1752624005.7,
        "raw": "",
        "value": 21,
        "unit": "km/h"
      },
      {
        "mode": 1,
        "pid": "0xc",
        "name": "engine_rpm",
        "t_utc": 1752624005.7,
        "raw": "",
        "value": 2965,
        "unit": "rpm"
      },
      {
        "mode": 1,
        "pid": "0x5",
        "name": "coolant_temp",
        "t_utc": 1752624005.7,
        "raw": "",
        "value": 40,
        "unit": "degC"
      },
      {
        "mode": 1,
        "pid": "0xd",
        "name": "vehicle_speed",
        "t_utc": 1752624006.2,
        "raw": "",
        "value": 23,
        "unit": "km/h"
      },
      {
        "mode": 1,
        "pid": "0xc",
        "name": "engine_rpm",
        "t_utc": 1752624006.2,
        "raw": "",
        "value": 3313,
        "unit": "rpm"
      },
      {
        "mode": 1,
        "pid": "0x5",
        "name": "coolant_temp",
        "t_utc": 1752624006.2,
        "raw": "",
        "value": 41,
        "unit": "degC"
      },
      {
        "mode": 1,
        "pid": "0xd",
        "name": "vehicle_speed",
        "t_utc": 1752624006.7,
        "raw": "",
        "value": 24,
        "unit": "km/h"
      },
      {
        "mode": 1,
        "pid": "0xc",
        "name": "engine_rpm",
        "t_utc": 1752624006.7,
        "raw": "",
        "value": 1104,
        "unit": "rpm"
      },
      {
        "mode": 1,
        "pid": "0x5",
        "name": "coolant_temp",
        "t_utc": 1752624006.7,
        "raw": "",
        "value": 41,
        "unit": "degC"
      },
      {
        "mode": 1,
        "pid": "0xd",
        "name": "vehicle_speed",
        "t_utc": 1752624007.2,
        "raw": "",
        "value": 26,
        "unit": "km/h"
      },
      {
        "mode": 1,
        "pid": "0xc",
        "name": "engine_rpm",
        "t_utc": 1752624007.2,
        "raw": "",
        "value": 1393,
        "unit": "rpm"
      },
      {
        "mode": 1,
        "pid": "0x5",
        "name": "coolant_temp",
        "t_utc": 1752624007.2,
        "raw": "",
        "value": 41,
        "unit": "degC"
      },
      {
        "mode": 1,
        "pid": "0xd",
        "name": "vehicle_speed",
        "t_utc": 1752624007.7,
        "raw": "",
        "value": 27,
        "unit": "km/h"
      },
      {
        "mode": 1,
        "pid": "0xc",
        "name": "engine_rpm",
        "t_utc": 1752624007.7,
        "raw": "",
        "value": 1650,
        "unit": "rpm"
      },
      {
        "mode": 1,
        "pid": "0x5",
        "name": "coolant_temp",
        "t_utc": 1752624007.7,
        "raw": "",
        "value": 41,
        "unit": "degC"
      },
      {
        "mode": 1,
        "pid": "0xd",
        "name": "vehicle_speed",
        "t_utc": 1752624008.2,
        "raw": "",
        "value": 28,
        "unit": "km/h"
      },
      {
        "mode": 1,
        "pid": "0xc",
        "name": "engine_rpm",
        "t_utc": 1752624008.2,
        "raw": "",
        "value": 1854,
        "unit": "rpm"
      },
      {
        "mode": 1,
        "pid": "0x5",
        "name": "coolant_temp",
        "t_utc": 1752624008.2,
        "raw": "",
        "value": 41,
        "unit": "degC"
      },
      {
        "mode": 1,
        "pid": "0xd",
        "name": "vehicle_speed",
        "t_utc": 1752624008.7,
        "raw": "",
        "value": 29,
        "unit": "km/h"
      },
      {
        "mode": 1,
        "pid": "0xc",
        "name": "engine_rpm",
        "t_utc": 1752624008.7,
        "raw": "",
        "value": 2043,
        "unit": "rpm"
      },
      {
        "mode": 1,
        "pid": "0x5",
        "name": "coolant_temp",
        "t_utc": 1752624008.7,
        "raw": "",
        "value": 41,
        "unit": "degC"
      },
      {
        "mode": 1,
        "pid": "0xd",
        "name": "vehicle_speed",
        "t_utc": 1752624009.2,
        "raw": "",
        "value": 30,
        "unit": "km/h"
      },
      {
        "mode": 1,
        "pid": "0xc",
        "name": "engine_rpm",
        "t_utc": 1752624009.2,
        "raw": "",
        "value": 2254,
        "unit": "rpm"
      },
      {
        "mode": 1,
        "pid": "0x5",
        "name": "coolant_temp",
        "t_utc": 1752624009.2,